bookID,title,authors,average_rating,isbn,isbn13,language_code,# num_pages,ratings_count,text_reviews_count
7733,Gulliver's Travels,Jonathan Swift-Robert DeMaria Jr.,3.56,0141439491,9780141439495,eng,306,185945,3273
10603,Cujo,Stephen King,3.7,0307348245,9780307348241,spa,432,185847,2537
6534,Postmortem (Kay Scarpetta  #1),Patricia Daniels Cornwell-Patricia Cornwell,4.02,0743477154,9780743477154,eng,342,185486,2015
22328,Neuromancer (Sprawl  #1),William Gibson,3.89,0441569595,9780441569595,eng,271,185418,5313
3682,A Great and Terrible Beauty (Gemma Doyle #1),Libba Bray,3.79,0689875347,9780689875342,eng,403,184607,8122
13152,The Angel Experiment (Maximum Ride  #1),James Patterson,4.08,0446617792,9780446617796,eng,413,184133,7559
8909,The War of the Worlds,H.G. Wells-Arthur C. Clarke,3.81,0375759239,9780375759239,eng,192,183750,4114
1295,The Clan of the Cave Bear (Earth's Children  #1),Jean M. Auel,4.04,0553381679,9780553381672,eng,512,183361,4406
2175,Madame Bovary,Gustave Flaubert-Malcolm Bowie-Margaret Mauldon-Tomás de C.  Duran-Mark Overstall-Victor Villarraza,3.66,0192840398,9780192840394,eng,329,183254,5640
7967,Speaker for the Dead (Ender's Saga  #2),Orson Scott Card,4.06,0812550757,9780812550757,eng,382,182235,6426
13642,A Wizard of Earthsea (Earthsea Cycle  #1),Ursula K. Le Guin,4.0,0553383043,9780553383041,eng,183,182174,5439
27523,Left Behind (Left Behind  #1),Tim LaHaye-Jerry B. Jenkins,3.83,0842342702,9780842342704,eng,342,181922,3216
28862,The Prince,Niccolò Machiavelli-Rufus Goodwin-Benjamin Martinez,3.8,0937832383,9780937832387,eng,140,180901,4005
16343,The Mysterious Affair at Styles (Hercule Poirot  #1),Agatha Christie,3.99,0646418432,9780646418438,eng,121,180757,3440
19321,The Tale of Peter Rabbit (Rabbit Ears),Beatrix Potter-طاهره آدینه پور,4.17,0723247706,9780723247708,eng,72,180490,1478
12873,Rebecca,Daphne du Maurier-Sally Beauman,4.22,1844080382,9781844080380,en-US,441,179051,8061
8921,The Hound of the Baskervilles (Sherlock Holmes  #5),Arthur Conan Doyle-Anne Perry-Maria Buitoni Duca-Sidney Paget,4.1,0451528018,9780451528018,eng,256,178632,4441
7069,The World According to Garp,John Irving,4.08,0345915593,9780345915597,eng,610,178515,3833
2784,Ways of Seeing,John Berger,3.78,0140135154,9780140135152,eng,176,177890,998
4934,The Brothers Karamazov,Fyodor Dostoyevsky-Richard Pevear-Larissa Volokhonsky,4.32,0374528373,9780374528379,eng,796,177444,6370
11422,Redeeming Love,Francine Rivers,4.49,1590525132,9781590525135,eng,464,176881,9453
46756,Oryx and Crake (MaddAddam  #1),Margaret Atwood,4.01,0385721676,9780385721677,eng,389,176663,9832
23919,The Complete Stories and Poems,Edgar Allan Poe,4.38,0385074077,9780385074070,eng,821,174162,1179
16735,The Prince of Tides,Pat Conroy,4.24,0553381547,9780553381542,eng,679,173886,3342
19380,Candide,Voltaire,3.76,0486266893,9780486266893,eng,129,172319,4526
34897,The Dragon Reborn (Wheel of Time  #3),Robert Jordan,4.25,0765305119,9780765305114,eng,624,171922,2398
5148,A Separate Peace,John Knowles,3.57,0743253973,9780743253970,eng,208,169719,5964
33313,Kitchen Confidential: Adventures in the Culinary Underbelly,Anthony Bourdain,4.06,0060899220,9780060899226,eng,312,168706,8782
10629,Christine,Stephen King-Marie Milpois,3.76,2253147699,9782253147695,fre,411,168523,1911
2547,The Prophet,Kahlil Gibran-جبران خليل جبران,4.23,000100039X,9780001000391,eng,127,167189,4996
14942,Mrs. Dalloway,Virginia Woolf-Maureen Howard,3.79,0151009988,9780151009985,eng,194,167000,5188
29059,Choke,Chuck Palahniuk,3.69,0385720920,9780385720922,eng,293,165418,5063
32682,Patriot Games (Jack Ryan  #1; Jack Ryan Universe  #2),Tom Clancy,4.13,0425134350,9780425134351,eng,503,164306,904
10567,Cell,Stephen King,3.65,1416524517,9781416524519,eng,449,163786,4231
5094,The Drawing of the Three (The Dark Tower  #2),Stephen King,4.23,0451210859,9780451210852,eng,463,163647,4846
13615,Death Note  Vol. 1: Boredom (Death Note  #1),Tsugumi Ohba-Pookie Rolf-Takeshi Obata,4.43,1421501686,9781421501680,eng,195,163578,2809
1869,Nickel and Dimed: On (Not) Getting by in America,Barbara Ehrenreich,3.62,0805063897,9780805063899,eng,240,163279,5673
5113,Franny and Zooey,J.D. Salinger,3.98,0316769029,9780316769020,eng,201,162510,4805
37732,Are You There God? It's Me  Margaret,Judy Blume,3.9,0689841582,9780689841583,eng,149,162497,4672
7669,Timeline,Michael Crichton,3.84,0099244721,9780099244721,eng,489,161774,3258
3985,The Amazing Adventures of Kavalier & Clay,Michael Chabon,4.17,0312282990,9780312282998,eng,639,161137,8971
22205,This Lullaby,Sarah Dessen,4.03,0142501557,9780142501559,eng,345,161054,4396
2696,The Canterbury Tales,Geoffrey Chaucer-Nevill Coghill,3.49,0140424385,9780140424386,eng,504,161011,2251
10569,On Writing: A Memoir of the Craft,Stephen King,4.33,0743455967,9780743455961,eng,320,160056,10972
46677,Alexander and the Terrible  Horrible  No Good  Very Bad Day,Judith Viorst-Ray Cruz,4.22,0689711735,9780689711732,eng,32,159680,2466
8694,Life  the Universe and Everything (Hitchhiker's Guide to the Galaxy  #3),Douglas Adams,4.2,0345418905,9780345418906,eng,224,158946,2036
15769,The Bourne Supremacy (Jason Bourne  #2),Robert Ludlum,4.11,0752863886,9780752863887,eng,688,158859,866
23754,Preludes & Nocturnes (The Sandman  #1),Neil Gaiman-Sam Kieth-Mike Dringenberg-Malcolm Jones III-Todd Klein-Karen  Berger,4.25,1563892278,9781563892271,eng,233,158629,3543
1067,1776,David McCullough,4.07,0743226720,9780743226721,eng,386,158126,6034
17690,The Trial,Franz Kafka-Willa Muir-Edwin Muir-Max Brod,3.98,0099428644,9780099428640,eng,255,158037,3472
629,Zen and the Art of Motorcycle Maintenance: An Inquiry Into Values,Robert M. Pirsig,3.77,0060589469,9780060589462,eng,540,157734,6101
17214,Starship Troopers,Robert A. Heinlein,4.0,0441783589,9780441783588,eng,335,157228,3765
2767,A People's History of the United States,Howard Zinn,4.08,0060838655,9780060838652,eng,729,156036,4511
11275,The Wind-Up Bird Chronicle,Haruki Murakami-Jay Rubin,4.17,0965341984,9780965341981,eng,607,155967,8928
7332,The Silmarillion (Middle-Earth Universe),J.R.R. Tolkien-Christopher Tolkien-Ted Nasmith,3.91,0618391118,9780618391110,eng,386,155132,4482
3980,From the Mixed-Up Files of Mrs. Basil E. Frankweiler,E.L. Konigsburg,4.15,0744583276,9780744583274,eng,178,154761,5057
4953,A Heartbreaking Work of Staggering Genius,Dave Eggers,3.68,0375725784,9780375725784,eng,485,154166,8473
2744,Anansi Boys,Neil Gaiman,4.02,0060515198,9780060515195,eng,387,153485,6986
5308,The Pearl,John Steinbeck,3.45,0142000698,9780142000694,eng,96,153111,5853
43814,The Vampire Lestat (The Vampire Chronicles  #2),Anne Rice,4.07,0345476883,9780345476883,eng,481,152168,2652
35729,Lover Eternal (Black Dagger Brotherhood  #2),J.R. Ward,4.35,0451218043,9780451218049,eng,441,152091,5181
3462,The Rescue,Nicholas Sparks,4.1,0446696129,9780446696128,eng,352,151617,3058
14201,Jonathan Strange & Mr Norrell,Susanna Clarke,3.82,0765356155,9780765356154,eng,1006,151294,9162
93,Heidi,Johanna Spyri-Beverly Cleary-Angelo  Rinaldi,3.98,0753454947,9780753454947,eng,352,150657,2175
3836,Don Quixote,Miguel de Cervantes Saavedra-Roberto González Echevarría-John Rutherford-Ernani Ssó,3.87,0142437239,9780142437230,eng,1023,150559,3770
29800,Scott Pilgrim  Volume 1: Scott Pilgrim's Precious Little Life,Bryan Lee O'Malley,4.16,1932664084,9781932664089,eng,168,149508,3130
6294,Howl's Moving Castle (Howl's Moving Castle  #1),Diana Wynne Jones,4.3,006441034X,9780064410342,eng,329,148957,8340
12938,King Lear,William Shakespeare,3.9,074348276X,9780743482769,eng,316,148902,2663
24765,Specials (Uglies  #3),Scott Westerfeld,3.77,0689865406,9780689865404,eng,384,148339,6668
10589,Bag of Bones,Stephen King,3.89,067102423X,9780671024239,eng,736,147964,2836
3109,The Omnivore's Dilemma: A Natural History of Four Meals,Michael Pollan,4.18,1594200823,9781594200823,eng,450,147893,10334
10605,Thinner,Richard Bachman-Stephen King,3.7,0451190750,9780451190758,eng,320,147510,1394
5349,The Rainmaker,John Grisham,3.93,0385339607,9780385339605,eng,419,146553,1414
12898,Death of a Salesman,Arthur  Miller,3.5,0435233076,9780435233075,eng,117,146272,2858
11573,The Dead Zone,Stephen King,3.92,0451155750,9780451155757,eng,402,145883,2279
15925,The Guardian,Nicholas Sparks,4.15,0446696110,9780446696111,eng,400,144654,4103
32145,Stiff: The Curious Lives of Human Cadavers,Mary Roach,4.06,0393324826,9780393324822,eng,303,144610,11109
16304,Murder on the Orient Express (Hercule Poirot  #10),Agatha Christie,4.16,0425200450,9780425200452,eng,322,144452,5688
5659,The Wind in the Willows,Kenneth Grahame-Gillian Avery,3.99,0143039091,9780143039099,eng,256,142146,3269
42900,Lover Awakened (Black Dagger Brotherhood  #3),J.R. Ward,4.45,0451219368,9780451219367,eng,448,141779,5591
43015,A Long Way Gone: Memoirs of a Boy Soldier,Ishmael Beah,4.15,0374105235,9780374105235,eng,229,141381,9284
10988,Drums of Autumn (Outlander  #4),Diana Gabaldon,4.35,0385335989,9780385335980,eng,880,140945,5450
6708,The Power of Now: A Guide to Spiritual Enlightenment,Eckhart Tolle,4.13,1577314808,9781577314806,eng,229,140443,6245
7672,Congo,Michael Crichton,3.58,0060541830,9780060541835,eng,442,140223,1468
19302,Pippi Longstocking,Astrid Lindgren-Florence Lamborn-Louis S. Glanzman,4.12,0142402494,9780142402498,eng,160,140107,2411
5472,Animal Farm / 1984,George Orwell-Christopher Hitchens,4.28,0151010269,9780151010264,eng,400,140015,1493
14864,Plain Truth,Jodi Picoult,3.97,0743275012,9780743275019,eng,405,139141,5642
34084,The Waste Lands (The Dark Tower  #3),Stephen King-Ned Dameron,4.24,0670032565,9780670032563,eng,422,138227,3214
15926,Nights in Rodanthe,Nicholas Sparks,3.83,0446612707,9780553813951,eng,222,137905,3499
9539,The Shadow Rising (Wheel of Time  #4),Robert Jordan,4.23,0812513738,9780812513738,eng,1007,137790,2209
2880,Bleach  Volume 01,Tite Kubo,4.22,1591164419,9781591164418,eng,200,136795,1011
42149,Baby Proof,Emily Giffin,3.71,0312348649,9780312348649,eng,340,136644,3070
30597,The Hunchback of Notre-Dame,Victor Hugo-Walter J. Cobb,3.99,0451527887,9780451527882,eng,510,136349,2406
33507,Twenty Thousand Leagues Under the Sea (Extraordinary Voyages  #6),Jules Verne-Anthony Bonner,3.88,076072850X,9780760728505,eng,394,135778,2925
9516,Persepolis: The Story of a Childhood (Persepolis  #1),Marjane Satrapi-Mattias Ripa,4.24,037571457X,9780375714573,eng,153,135456,7571
47021,The Taming of the Shrew,William Shakespeare-Chris Abraham-Barry Avrich,3.8,074347757X,9780743477574,eng,291,135053,2133
37190,The Tale of Despereaux,Kate DiCamillo-Timothy Basil Ering,4.03,0763625299,9780763625290,eng,267,134961,8189
1554,Oedipus Rex  (The Theban Plays  #1),Sophocles-J.E. Thomas,3.69,1580495931,9781580495936,eng,75,134960,1646
902,The Westing Game,Ellen Raskin,4.02,014240120X,9780142401200,eng,182,134362,8278
45107,Assassin's Apprentice (Farseer Trilogy  #1),Robin Hobb,4.15,0006480098,9780006480099,eng,460,133972,3844
1625,Twelfth Night,William Shakespeare,3.98,0743482778,9780743482776,eng,220,133832,2321
13747,Julie and Julia: 365 Days  524 Recipes  1 Tiny Apartment Kitchen,Julie Powell,3.7,031610969X,9780316109697,eng,310,133643,5797
13006,Julius Caesar,William Shakespeare-Roma Gill-فرنگیس شادمان,3.67,0198320272,9780198320272,eng,128,133575,2519
16181,The Constant Princess (The Plantagenet and Tudor Novels  #6),Philippa Gregory,3.89,0743272498,9780743272490,eng,390,133277,3839
9328,The House of the Spirits,Isabel Allende-Magda Bogin,4.22,0553383809,9780553383805,eng,448,133127,4334
2373,The Bone Collector (Lincoln Rhyme  #1),Jeffery Deaver,4.19,0451188454,9780451188458,eng,528,132188,1636
11570,Dreamcatcher,Stephen King-William Olivier Desmond-Maria Teresa Marenco,3.62,2226131906,9782226131904,fre,688,130976,1505
28881,Lamb: The Gospel According to Biff  Christ's Childhood Pal,Christopher Moore,4.26,0380813815,9780380813810,eng,444,130754,10223
24128,The Merchant of Venice,William Shakespeare-Robert          Jackson-Barbara A. Mowat-Paul Werstine,3.8,0743477561,9780743477567,eng,237,130122,2236
21686,Shutter Island,Dennis Lehane,4.09,038073186X,9780380731862,eng,369,128927,6125
3805,The Corrections,Jonathan Franzen,3.79,1841156736,9781841156736,eng,653,128702,7314
9532,Ender's Shadow (The Shadow Series  #1),Orson Scott Card,4.31,0765342405,9780765342409,eng,469,128211,4147
7494,Suzanne's Diary for Nicholas,James Patterson,4.16,0446611085,9780446611084,eng,289,128191,4174
12936,Gathering Blue,Lois Lowry,3.81,0385732562,9780385732567,eng,240,127855,9094
30289,The Republic,Plato-Desmond Lee,3.93,0140449140,9780140449143,eng,416,127393,1871
10847,Under the Banner of Heaven: A Story of Violent Faith,Jon Krakauer,3.99,0330419129,9780330419123,eng,369,126672,8179
5439,Interpreter of Maladies,Jhumpa Lahiri,4.14,0618101365,9780618101368,eng,198,126443,7604
1431,Veronika Decides to Die,Paulo Coelho-Margaret Jull Costa,3.7,0061124265,9780061124266,eng,210,126224,5201
1274,Men Are from Mars  Women Are from Venus,John Gray,3.54,0060574216,9780060574215,eng,368,126108,3115
6427,Two for the Dough (Stephanie Plum  #2),Janet Evanovich,4.11,0140255559,9780140255553,eng,326,125313,3329
2199,Team of Rivals: The Political Genius of Abraham Lincoln,Doris Kearns Goodwin,4.28,0743270754,9780743270755,eng,916,125020,5912
10959,Sophie's World,Jostein Gaarder-Paulette Møller,3.91,1857993284,9781857993288,eng,403,124543,4823
3466,The Wedding (The Notebook  #2),Nicholas Sparks,3.98,0446615862,9780446615860,eng,276,124127,5221
3463,A Bend in the Road,Nicholas Sparks,4.03,0446696137,9780446696135,eng,341,123319,3173
5479,Brave New World / Brave New World Revisited,Aldous Huxley-Christopher Hitchens,4.16,0060776099,9780060776091,eng,340,123044,988
5096,Wizard and Glass (The Dark Tower  #4),Stephen King-Dave McKean,4.25,0340829788,9780340829783,eng,845,122796,3396
43448,Flowers in the Attic (Dollanganger  #1),V.C. Andrews,3.8,0743496310,9780743496315,eng,389,122524,5367
11337,The Bluest Eye,Toni Morrison,4.01,0452287065,9780452287068,eng,216,121960,4679
6854,Three to Get Deadly (Stephanie Plum  #3),Janet Evanovich,4.15,0312966091,9780312966096,eng,344,121709,2835
9742,The Audacity of Hope: Thoughts on Reclaiming the American Dream,Barack Obama,3.73,0307237699,9780307237699,en-US,375,121607,4379
16902,Walden,Henry David Thoreau,3.79,0691096120,9780691096124,eng,352,121540,3386
39662,Different Seasons,Stephen King,4.35,0751514624,9780751514629,eng,560,121420,1914
10967,The Fiery Cross (Outlander  #5),Diana Gabaldon,4.27,0440221668,9780440221661,eng,1443,120981,4947
4978,Wolves of the Calla (The Dark Tower  #5),Stephen King-Bernie Wrightson,4.19,141651693X,9781416516934,eng,931,120906,2640
27712,The Neverending Story,Michael Ende-Ralph Manheim-Roswitha Quadflieg,4.18,0525457585,9780525457589,eng,396,120667,3452
3087,A Room with a View,E.M. Forster,3.9,1420925431,9781420925432,eng,119,120061,3224
29581,Foundation and Empire (Foundation #2),Isaac Asimov-Sönmez Güven,4.22,0553803727,9780553803723,eng,256,120046,1897
37741,Tales of a Fourth Grade Nothing (Fudge  #1),Judy Blume,4.1,0425193799,9780425193792,eng,144,119927,2029
40024,The Alienist (Dr. Laszlo Kreizler  #1),Caleb Carr,4.06,0812976142,9780812976144,eng,498,119839,5295
10628,Night Shift,Stephen King-John D. MacDonald,3.99,0450042685,9780450042683,eng,409,119820,1604
32508,The Black Echo (Harry Bosch  #1; Harry Bosch Universe  #1),Michael Connelly,4.1,0446612731,9780446612739,eng,482,119217,3019
43758,The Queen of the Damned (The Vampire Chronicles  #3),Anne Rice,3.88,0345419626,9780345419620,eng,448,118857,1644
30868,The Bean Trees (Greer Family  #1),Barbara Kingsolver,3.96,0812474945,9780812474947,eng,232,117003,5141
11149,The Screwtape Letters,C.S. Lewis,4.22,0060652896,9780060652890,eng,224,116735,4760
32669,Clear and Present Danger (Jack Ryan Universe  #6),Tom Clancy,4.1,0425144372,9780425144374,eng,688,116535,576
4965,Year of Wonders,Geraldine Brooks,4.01,0142001430,9780142001431,eng,358,115677,8261
8648,Xenocide (Ender's Saga  #3),Orson Scott Card-Piotr W. Cholewa,3.79,0312861877,9780312861872,eng,592,115661,3038
21326,Fables  Vol. 1: Legends in Exile,Bill Willingham-Terry Moore-Mike Allred-Lan Medina-Mark Buckingham-Matthew Sturges-Steve Leialoha-Craig Hamilton-Russ Braun-James Jean-Tony Akins-Eric Shanower-Shawn McManus-Jae Lee-Chrissie Zullo-David Petersen,3.97,1563899426,9781563899423,eng,128,115639,2779
7354,The Shipping News,Annie Proulx,3.85,0743225422,9780743225427,eng,337,114923,3787
1430,Eleven Minutes,Paulo Coelho-Margaret Jull Costa,3.69,0060589280,9780060589288,eng,273,114826,4731
8073,Cloudy With a Chance of Meatballs,Judi Barrett-Ron Barrett,4.16,0689707495,9780689707490,eng,32,114747,1948
6422,Four to Score (Stephanie Plum  #4),Janet Evanovich,4.17,0312966970,9780312966973,eng,313,114593,2450
12497,No Country for Old Men,Cormac McCarthy,4.13,0375706674,9780375706677,eng,309,114408,5872
30120,Falling Up,Shel Silverstein,4.34,0060513098,9780060513092,eng,178,114058,1341
16331,Murder at the Vicarage (Miss Marple #1),Agatha Christie,4.05,1579126251,9781579126254,eng,288,113459,1976
10585,Insomnia,Stephen King-Bettina Blanch Tyroller,3.81,8497597729,9788497597722,spa,890,113304,1873
43035,White Fang,Jack London,3.96,0439236193,9780439236195,eng,252,113232,2945
30281,Guilty Pleasures (Anita Blake  Vampire Hunter  #1),Laurell K. Hamilton,4.02,0425197549,9780425197547,eng,355,112848,3957
7815,The Year of Magical Thinking,Joan Didion,3.88,1400078431,9781400078431,eng,227,112599,8270
44186,The Monster at the End of this Book,Jon Stone-Michael J. Smollin,4.44,037582913X,9780375829130,eng,32,112374,2499
44652,Fablehaven (Fablehaven  #1),Brandon Mull,4.09,1590385810,9781590385814,eng,351,111896,8537
13912,A Beautiful Mind,Sylvia Nasar,4.13,0571212921,9780571212927,eng,461,111633,978
15197,Maus II: A Survivor's Tale: And Here My Troubles Began (Maus  #2),Art Spiegelman,4.39,0679729771,9780679729778,eng,144,111555,2664
29580,Second Foundation (Foundation #3),Isaac Asimov,4.25,0553803735,9780553803730,eng,256,111510,1596
32692,Gerald's Game,Stephen King,3.5,0831727527,9780831727529,eng,332,110879,2514
4009,Nine Stories,J.D. Salinger,4.19,0316767727,9780316767729,eng,198,110786,2817
5161,The Deep End of the Ocean (Cappadora Family  #1),Jacquelyn Mitchard,3.86,0140286276,9780140286274,eng,464,110552,997
10929,For One More Day,Mitch Albom,4.1,1401303277,9781401303273,eng,197,110140,6625
5355,The Chamber,John Grisham,3.78,0385339666,9780385339667,eng,632,109897,1285
19089,Middlemarch,George Eliot-Michel Faber,3.95,0451529170,9780451529176,eng,904,109685,4379
152,Anna Karenina,Leo Tolstoy-David Magarshack-Priscilla Meyer,4.04,0451528611,9780451528612,eng,960,108970,5694
9420,Shopaholic & Baby (Shopaholic  #5),Sophie Kinsella,3.79,0385338708,9780385338707,eng,359,108789,2041
5211,A Fine Balance,Rohinton Mistry,4.36,140003065X,9781400030651,eng,603,108208,7248
15997,Paradise Lost,John Milton-John      Leonard,3.81,0140424393,9780140424393,eng,453,107568,2424
11899,The Hours,Michael Cunningham,3.93,0312305060,9780312305062,eng,230,107519,3525
3867,The History of Love,Nicole Krauss,3.92,0393328627,9780393328622,eng,255,107024,9640
41681,The Jungle,Upton Sinclair-Earl Lee-Kathleen DeGrave,3.73,1884365302,9781884365300,eng,335,106675,3993
667,Anthem,Ayn Rand,3.63,0452281253,9780452281257,eng,105,106642,6951
4271,About a Boy,Nick Hornby,3.8,0140285679,9780140285673,eng,307,106510,2124
19057,I Am the Messenger,Markus Zusak,4.08,0375836675,9780375836671,eng,357,106498,11074
13895,The Fires of Heaven (Wheel of Time  #5),Robert Jordan,4.15,1857232097,9781857232097,eng,912,106302,1503
6858,Hot Six (Stephanie Plum  #6),Janet Evanovich,4.19,0312976275,9780312976279,eng,336,106282,2036
10909,The Tenth Circle,Jodi Picoult,3.49,074349671X,9780743496711,eng,416,106201,4970
2526,Blindness,José Saramago-Giovanni Pontiero,4.11,0156007754,9780156007757,eng,326,106162,7807
5544,Surely You're Joking  Mr. Feynman!: Adventures of a Curious Character,Richard Feynman,4.28,0393316041,9780393316049,eng,391,105685,3613
12555,The Bonesetter's Daughter,Amy Tan,3.98,0345457374,9780345457370,eng,368,105432,2599
21671,Mystic River,Dennis Lehane,4.18,0060584750,9780060584757,eng,416,105317,2735
11597,The Dark Half,Stephen King,3.76,045052468X,9780450524684,eng,469,105027,1186
5890,The Woman in White,Wilkie Collins-Matthew Sweet,3.99,0141439610,9780141439617,eng,672,104614,4931
42898,Lover Revealed (Black Dagger Brotherhood  #4),J.R. Ward,4.3,0451412354,9780451412355,eng,455,104180,3616
870,Fullmetal Alchemist  Vol. 1 (Fullmetal Alchemist  #1),Hiromu Arakawa-Akira Watanabe,4.49,1591169208,9781591169208,eng,192,103978,1326
34507,Equal Rites (Discworld  #3; Witches  #1),Terry Pratchett,4.02,0060855908,9780060855901,eng,228,103822,2069
32263,The Surgeon (Rizzoli & Isles  #1),Tess Gerritsen,4.1,055381706X,9780553817065,eng,416,103747,2766
21611,The Forever War (The Forever War  #1),Joe Haldeman,4.15,0060510862,9780060510862,eng,278,103375,3780
35231,Lord of Chaos (Wheel of Time  #6),Robert Jordan,4.12,0812513754,9780812513752,eng,1011,102983,1778
43070,The Essential Calvin and Hobbes: A Calvin and Hobbes Treasury,Bill Watterson,4.64,0836218051,9780836218053,eng,256,102955,619
7603,Reading Lolita in Tehran: A Memoir in Books,Azar Nafisi,3.6,081297106X,9780812971064,eng,356,102707,6444
18116,His Dark Materials (His Dark Materials #1-3),Philip Pullman-Peter Bailey,4.26,0440238609,9780440238607,eng,1088,102687,3761
7588,A Portrait of the Artist as a Young Man,James Joyce-Seamus Deane,3.61,0142437344,9780142437346,eng,329,102308,3352
13139,School's Out—Forever (Maximum Ride  #2),James Patterson,4.15,0316155594,9780316155595,eng,409,101968,2684
32829,Journey to the Center of the Earth (Extraordinary Voyages  #3),Jules Verne,3.85,0553213970,9780553213973,eng,240,101764,2353
17184,The Invisible Man,H.G. Wells,3.63,0451528522,9780451528520,eng,192,101659,3563
31463,Far From the Madding Crowd,Thomas Hardy-Rosemarie Morgan-Shannon Russell,3.94,0141439653,9780141439655,eng,433,101129,3605
6424,Seven Up (Stephanie Plum  #7),Janet Evanovich,4.16,0312980140,9780312980146,en-US,337,101029,1776
13890,A Crown of Swords (Wheel of Time  #7),Robert Jordan,4.03,0812550285,9780812550283,eng,880,100910,1459
5797,Vanity Fair,William Makepeace Thackeray-John Carey,3.78,0141439831,9780141439839,eng,867,100384,2174
10965,A Breath of Snow and Ashes (Outlander  #6),Diana Gabaldon,4.44,0385340397,9780385340397,eng,980,100326,3845
15195,The Complete Maus,Art Spiegelman,4.55,0141014083,9780141014081,eng,296,100212,5436
10884,Einstein: His Life and Universe,Walter Isaacson,4.1,0743264738,9780743264730,eng,675,99410,2654
6425,Hard Eight (Stephanie Plum  #8),Janet Evanovich-Lorelei King,4.17,0312983867,9780312983864,eng,326,99289,1834
6423,High Five (Stephanie Plum  #5),Janet Evanovich,4.18,0330371231,9780330371230,eng,336,99172,1746
9418,Shopaholic Takes Manhattan (Shopaholic  #2),Sophie Kinsella,3.76,0440241812,9780440241812,eng,387,97984,2359
33512,One Thousand White Women: The Journals of May Dodd (One Thousand White Women  #1),Jim Fergus,3.88,0312199430,9780312199432,eng,434,97955,7382
2052,The Big Sleep (Philip Marlowe  #1),Raymond Chandler,4.01,0394758285,9780394758282,eng,231,97885,3818
30,J.R.R. Tolkien 4-Book Boxed Set: The Hobbit and The Lord of the Rings,J.R.R. Tolkien,4.59,0345538374,9780345538376,eng,1728,97731,1536
30264,Dead Witch Walking (The Hollows  #1),Kim Harrison,4.04,0060572965,9780060572969,en-US,416,97105,3995
13831,Alanna: The First Adventure (Song of the Lioness  #1),Tamora Pierce,4.27,0689878559,9780689878558,eng,274,96683,3648
106,Dune Messiah (Dune Chronicles #2),Frank Herbert,3.87,0441172695,9780441172696,eng,331,96649,2306
3711,White Teeth,Zadie Smith,3.76,0375703861,9780375703867,eng,448,96220,5370
1633,Getting Things Done: The Art of Stress-Free Productivity,David    Allen,3.99,0142000280,9780142000281,en-GB,267,95950,3597
46306,The Complete Fairy Tales,Hans Christian Andersen-Lily Owens-Arthur Rackham-Hans Richter,4.28,0517092913,9780517092910,eng,803,95929,439
3579,The Complete Anne of Green Gables Boxed Set (Anne of Green Gables  #1-8),L.M. Montgomery,4.43,0553609416,76783609419,eng,2088,95486,1449
16527,Daughter of Fortune,Isabel Allende-Margaret Sayers Peden,3.9,0061120251,9780061120251,eng,432,95447,2657
8650,The Lost World (Jurassic Park #2),Michael Crichton,3.76,0752224417,9780752224411,eng,448,95109,2289
21348,Aesop's Fables,Aesop-Laura Harris-Laura Gibbs,4.05,0192840509,9780192840509,eng,306,95008,901
10883,Benjamin Franklin: An American Life,Walter Isaacson,3.99,074325807X,9780743258074,eng,586,94903,1613
8698,So Long  and Thanks for All the Fish (Hitchhiker's Guide to the Galaxy  #4),Douglas Adams,4.09,0330491237,9780330491235,eng,167,93987,1391
27003,The Eyre Affair (Thursday Next  #1),Jasper Fforde,3.91,0142001805,9780142001806,eng,374,93927,7844
5350,The Partner,John Grisham,3.91,0385339100,9780385339100,eng,416,93917,1814
13440,Skeleton Crew,Stephen King,3.95,0751504386,9780751504385,eng,612,93593,1078
16328,The Murder of Roger Ackroyd (Hercule Poirot  #4),Agatha Christie,4.23,1579126278,9781579126278,eng,288,93453,4962
16631,Steppenwolf,Hermann Hesse-Basil Creighton,4.12,0140282580,9780140282580,eng,256,93199,2123
9419,Shopaholic Ties the Knot (Shopaholic  #3),Sophie Kinsella,3.77,0440241898,9780440241898,eng,407,93132,2049
31456,The Twits,Roald Dahl-Quentin Blake,3.95,0141318309,9780141318301,eng,96,93010,2419
40331,To the Nines (Stephanie Plum  #9),Janet Evanovich,4.17,0747267634,9780747267638,eng,320,92976,1533
4799,Cannery Row,John Steinbeck,4.03,014200068X,9780142000687,eng,181,92582,3681
7214,Blue Like Jazz: Nonreligious Thoughts on Christian Spirituality,Donald Miller,3.91,0785263705,9780785263708,eng,243,92413,3671
47401,Chocolat (Chocolat  #1),Joanne Harris,3.96,014100018X,9780141000183,eng,306,92266,2884
4136,Holidays on Ice,David Sedaris,3.93,0316191299,9780316191296,eng,176,90802,4066
