bookID,title,authors,average_rating,isbn,isbn13,language_code,# num_pages,ratings_count,text_reviews_count
46164,Tender Is the Night,F. Scott Fitzgerald,3.82,068480154X,9780684801544,eng,315,90467,3227
24800,House of Leaves,Mark Z. Danielewski,4.12,038560310X,9780385603102,eng,705,90180,6932
11003,Eleven on Top (Stephanie Plum  #11),Janet Evanovich,4.16,0312985347,9780312985349,eng,321,89961,1689
16690,The Moon is a Harsh Mistress,Robert A. Heinlein,4.17,0340837942,9780340837948,eng,288,89921,2347
29209,The Color of Water: A Black Man's Tribute to His White Mother,James McBride,4.08,1573225789,9781573225786,eng,291,89841,4432
43933,Tell No One,Harlan Coben,4.11,0440236703,9780440236702,eng,370,89615,3812
12930,Messenger,Lois Lowry,3.91,0385732538,9780385732536,eng,169,89571,6445
17150,My Ántonia (Great Plains Trilogy  #3),Willa Cather,3.78,1583485090,9781583485095,eng,232,89067,4484
1005,Think and Grow Rich: The Landmark Bestseller Now Revised and Updated for the 21st Century,Napoleon Hill,4.18,1585424331,9781585424337,eng,320,88437,2305
28195,Inkspell,Cornelia Funke-Anthea Bell,3.92,0439554004,9780439554008,eng,635,88095,3094
33456,A Dirty Job (Grim Reaper  #1),Christopher Moore,4.07,0060590270,9780060590277,en-US,387,88016,5333
5246,Ethan Frome,Edith Wharton,3.38,0142437808,9780142437803,eng,189,87790,3725
17683,Dead Beat (The Dresden Files  #7),Jim Butcher,4.44,045146091X,9780451460912,eng,517,87727,2630
47624,Lirael (Abhorsen  #2),Garth Nix,4.3,0060590165,9780060590161,en-US,464,87623,1828
12505,The Idiot,Fyodor Dostoyevsky-Constance Garnett-Alan Myers-Joseph Frank-Anna Brailovsky,4.18,0679642420,9780679642428,eng,667,87327,2559
